voets-2019.md	Voets, M., Møllersen, K., & Bongo, L. A. (2019). Reproduction study using public data of: Development and validation of a deep learning algorithm for detection of diabetic retinopathy in retinal fundus photographs. PLoS ONE, 14(6), e0217541.
wan-2021-ead-net.md	Wan, C., Chen, Y., Li, H., Zheng, B., Chen, N., Yang, W., Wang, C., & Li, Y. (2021). EAD-Net: A novel lesion segmentation method in diabetic retinopathy using neural networks. Disease Markers, 2021, Article 6482665. https://doi.org/10.1155/2021/6482665
wang-2004-ssim.md	Wang, Z., Bovik, A. C., Sheikh, H. R., & Simoncelli, E. P. (2004). Image Quality Assessment: From Error Visibility to Structural Similarity. IEEE Transactions on Image Processing, 13(4), 600–612.
wang-2018-deep-visual-domain-adaptation-survey.md	Wang, M., & Deng, W. (2018). Deep visual domain adaptation: A survey. Neurocomputing.
wang-lo-2018.md	Wang, W., & Lo, A. C. Y. (2018). Diabetic retinopathy: Pathophysiology and treatments. International Journal of Molecular Sciences, 19(6), 1816. https://doi.org/10.3390/ijms19061816
wewetzer-2021.md	Wewetzer, Held, & Steinhäuser (2021) — Meta-Analysis of DL Screening for DR in Primary Care
xu-2024-hybrid.md	Full Citation (APA 7)	Xu, H., Shao, X., Fang, D., & Huang, F. (2024). A hybrid neural network approach for classifying diabetic retinopathy subtypes. Frontiers in Medicine, 10, 1293019.
yosinski-2014-transferability-features.md	Yosinski, J., Clune, J., Bengio, Y., & Lipson, H. (2014). How transferable are features in deep neural networks? In Advances in Neural Information Processing Systems (NeurIPS/NIPS 2014).
zago-2018-riqa.md	Zago, G. T., Andreão, R. V., Dorizzi, B., & Teatini Salles, E. O. (2018). Retinal image quality assessment using deep learning. Computers in Biology and Medicine, 103, 64–70.
zhang-2018-mixup.md	Zhang, H., Cisse, M., Dauphin, Y. N., & Lopez-Paz, D. (2018). mixup: Beyond Empirical Risk Minimization. Proceedings of the 6th International Conference on Learning Representations (ICLR). (arXiv:1710.09412)
zhang-2022-multicentre.md	Zhang, G., Lin, J.-W., Wang, J., Ji, J., Cen, L.-P., Chen, W., Xie, P., Zheng, Y., Xiong, Y., Wu, H., Li, D., Ng, T. K., Pang, C. P., & Zhang, M. (2022). Automated multidimensional deep learning platform for referable diabetic retinopathy detection: A multicentre, retrospective study. BMJ Open, 12, e060155. https://doi.org/10.1136/bmjopen-2021-060155
zhou-2016-cam.md	Zhou, B., Khosla, A., Lapedriza, A., Oliva, A., & Torralba, A. (2016). Learning Deep Features for Discriminative Localization. In Proceedings of the IEEE Conference on Computer Vision and Pattern Recognition (CVPR 2016) (pp. 2921–2929).
zhou-2020-fgadr-benchmark.md	Zhou, Y., Wang, B., Huang, L., Cui, S., & Shao, L. (2020). A Benchmark for Studying Diabetic Retinopathy: Segmentation, Grading, and Transferability. IEEE Transactions on Medical Imaging, 40(3), 818–828. (Preprint: arXiv:2008.09772v3.)
zhou-2022-domain-generalization-survey.md	Zhou, K., Liu, Z., Qiao, Y., Xiang, T., & Loy, C. C. (2022). Domain Generalization: A Survey.
zhou-2023-retfound.md	Zhou, Y., Chia, M. A., Wagner, S. K., Ayhan, M. S., Williamson, D. J., Struyven, R. R., … Keane, P. A. (2023). A foundation model for generalizable disease detection from retinal images. Nature, 622(7981), 156–163.
zuiderveld-1994-clahe.md	Zuiderveld, K. (1994). Contrast Limited Adaptive Histogram Equalization. In P. S. Heckbert (Ed.), Graphics Gems IV (pp. 474–485). Academic Press.
yesmukhamedov-conf.md	[NO APA LINE]
yesmukhamedov-kazutb.md	[NO APA LINE]
yesmukhamedov-kbtu.md	[NO APA LINE]
yesmukhamedov-nan-rk.md	Pallavi et al. (2022) — AI applications in healthcare, clinical decision support
yesmukhamedov-scopus-q2.md	Full Bibliographic Citation: Sapakova, S., Yesmukhamedov, N., & Sapakov, A. (2025). Development of an image quality enhancement approach for diabetic retinopathy diagnosis. Eastern-European Journal of Enterprise Technologies, 4(9(136)), 79–88. https://doi.org/10.15587/1729-4061.2025.335570
yesmukhamedov-scopus-q3.md	Full Bibliographic Citation: Sapakova, S., Yesmukhamedov, N., & Sapakov, A. (2025). Development of an image quality enhancement approach for diabetic retinopathy diagnosis. Eastern-European Journal of Enterprise Technologies, 4(9(136)), 79–88. https://doi.org/10.15587/1729-4061.2025.335570
wikipedia-clahe.md	[NO APA LINE]