abramoff-2018-clinical-ai-validation.md	Abràmoff, M. D., Lavin, P. T., Birch, M., Shah, N., & Folk, J. C. (2018). Pivotal trial of an autonomous AI-based diagnostic system for detection of diabetic retinopathy in primary care offices. npj Digital Medicine, 1(39). https://doi.org/10.1038/s41746-018-0040-6.
araf-2024.md	Araf, I., Idri, A., & Chairi, I. (2024). Cost-sensitive learning for imbalanced medical data: a review. Artificial Intelligence Review, 57, 80. https://doi.org/10.1007/s10462-023-10652-8
arora-2024-efficientnet.md	Arora, L., Singh, S. K., Kumar, S., Gupta, H., Alhalabi, W., Arya, V., Bansal, S., Chui, K. T., & Gupta, B. B. (2024). Ensemble deep learning and EfficientNet for accurate diagnosis of diabetic retinopathy. Scientific Reports, 14, 30554. https://doi.org/10.1038/s41598-024-81132-4
arrieta-2022.md	Arrieta, J., Perdomo, O. J., & González, F. A. (2022). Deep semi-supervised and self-supervised learning for diabetic retinopathy detection. arXiv:2208.02408v1.
azizi-2021-micle.md	Azizi, S., Mustafa, B., Ryan, F., Beaver, Z., Freyberg, J., Deaton, J., … Norouzi, M. (2021). Big Self-Supervised Models Advance Medical Image Classification. Proceedings of the IEEE/CVF International Conference on Computer Vision (ICCV). (arXiv:2101.05224)
baget-bernaldiz-2021.md	Baget-Bernaldiz, M., Romero-Aroca, P., Santos-Blanco, E., Navarro-Gil, R., Valls, A., Moreno, A., Rashwan, H. A., & Puig, D. (2021). Testing a deep learning algorithm for detection of diabetic retinopathy in a Spanish diabetic population and with MESSIDOR database. Diagnostics, 11(8), 1385.
beede-2020-human-centered-dr.md	Beede, E., Baylor, E., Hersch, F., Iurchenko, A., Wilcox, L., Ruamviboonsuk, P., & Vardoulakis, L. M. (2020). A Human-Centered Evaluation of a Deep Learning System Deployed in Clinics for the Detection of Diabetic Retinopathy. Proceedings of the 2020 CHI Conference on Human Factors in Computing Systems (CHI '20), 1–12.
bellemo-2019-ai-dr-africa.md	Bellemo, V., Lim, Z. W., Lim, G., Nguyen, Q. D., Xie, Y., Yip, M. Y. T., … Ting, D. S. W. (2019). Artificial intelligence using deep learning to screen for referable and vision-threatening diabetic retinopathy in Africa: a clinical validation study. The Lancet Digital Health, 1(1), e35–e44.
brancati-2025-fhir.md	Brancati, N., Conte, T., De Pietro, S., Russo, M., & Sicuranza, M. (2025). Machine learning-enhanced architecture model for integrated and FHIR-based health data. Preprints.org, 2025090818. https://doi.org/10.20944/preprints202509.0818.v1
buades-2011-non-local-means.md	Buades, A., Coll, B., & Morel, J.-M. (2011). Non-Local Means Denoising. Image Processing On Line, 1, 208–212. https://doi.org/10.5201/ipol.2011.bcm_nlm.
buda-2018-class-imbalance.md	Buda, M., Maki, A., & Mazurowski, M. A. (2018). A systematic study of the class imbalance problem in convolutional neural networks. Neural Networks, 106, 249–259. (arXiv:1710.05381)
burlina-2017-amd-dcnn.md	Burlina, P. M., Joshi, N., Pekala, M., Pacheco, K. D., Freund, D. E., & Bressler, N. M. (2017). Automated Grading of Age-Related Macular Degeneration From Color Fundus Images Using Deep Convolutional Neural Networks. JAMA Ophthalmology, 135(11), 1170–1176.
caron-2021-dino.md	Caron, M., Touvron, H., Misra, I., Jégou, H., Mairal, J., Bojanowski, P., & Joulin, A. (2021). Emerging Properties in Self-Supervised Vision Transformers. Proceedings of the IEEE/CVF International Conference on Computer Vision (ICCV), 9650–9660. (arXiv:2104.14294)
chakka-2023.md	Full Citation (APA 7)	Chakka, L. (2023). Analyzing optimal image preprocessing techniques for automated retinal disease diagnosis. The National High School Journal of Science. https://nhsjs.com/
chattopadhyay-2018-grad-cam-plus-plus.md	Chattopadhyay, A., Sarkar, A., Howlader, P., & Balasubramanian, V. N. (2018). Grad-CAM++: Improved visual explanations for deep convolutional networks. arXiv preprint arXiv:1710.11063.
chen-2020-simclr.md	Chen, T., Kornblith, S., Norouzi, M., & Hinton, G. (2020). A Simple Framework for Contrastive Learning of Visual Representations. Proceedings of the 37th International Conference on Machine Learning (ICML), 1597–1607. (arXiv:2002.05709)
chen-2021-simsiam.md	Chen, X., & He, K. (2021). Exploring Simple Siamese Representation Learning. Proceedings of the IEEE/CVF Conference on Computer Vision and Pattern Recognition (CVPR), 15750–15758. (arXiv:2011.10566)
cheplygina-2018-not-so-supervised-survey.md	Cheplygina, V., de Bruijne, M., & Pluim, J. P. W. (2018). Not-so-supervised: A survey of semi-supervised, multi-instance, and transfer learning in medical image analysis. [Preprint]. arXiv.
chin-2021-encrypted-cloud-search.md	Chin, T.-L., & Shih, W.-N. (2021). Concisely indexed multi-keyword rank search on encrypted cloud documents. Applied Sciences, 11(23), 11529. https://doi.org/10.3390/app112311529
cuadros-2009-eyepacs.md	Cuadros, J., & Bresnick, G. (2009). EyePACS: An Adaptable Telemedicine System for Diabetic Retinopathy Screening. Journal of Diabetes Science and Technology, 3(3), 509–516.
cubuk-2020-randaugment.md	Cubuk, E. D., Zoph, B., Shlens, J., & Le, Q. V. (2020). RandAugment: Practical automated data augmentation with a reduced search space. Proceedings of the IEEE/CVF Conference on Computer Vision and Pattern Recognition Workshops (CVPRW), 702–703. (arXiv:1909.13719)
cui-2019-class-balanced-loss.md	Cui, Y., Jia, M., Lin, T.-Y., Song, Y., & Belongie, S. (2019). Class-Balanced Loss Based on Effective Number of Samples. Proceedings of the IEEE/CVF Conference on Computer Vision and Pattern Recognition (CVPR), 9268–9277. (arXiv:1901.05555)
dai-2021-deepdr.md	Dai, L., Wu, L., Li, H., Cai, C., Wu, Q., Kong, H., … Jia, W. (2021). A deep learning system for detecting diabetic retinopathy across the disease spectrum. Nature Communications, 12, 3242.
decenciere-2014-messidor.md	Decencière, E., Zhang, X., Cazuguel, G., Lay, B., Cochener, B., Trone, C., Gain, P., Ordóñez-Varela, J.-R., Massin, P., Erginay, A., Charton, B., & Klein, J.-C. (2014). Feedback on a Publicly Distributed Image Database: The Messidor Database. Image Analysis & Stereology, 33(3), 231–234.
defauw-2018-retinal-oct.md	De Fauw, J., Ledsam, J. R., Romera-Paredes, B., Nikolov, S., Tomasev, N., Blackwell, S., … Ronneberger, O. (2018). Clinically applicable deep learning for diagnosis and referral in retinal disease. Nature Medicine, 24(9), 1342–1350.
dosovitskiy-2021-vision-transformer.md	Dosovitskiy, A., Beyer, L., Kolesnikov, A., Weissenborn, D., Zhai, X., Unterthiner, T., Dehghani, M., Minderer, M., Heigold, G., Gelly, S., Uszkoreit, J., & Houlsby, N. (2021). An image is worth 16×16 words: Transformers for image recognition at scale. International Conference on Learning Representations (ICLR 2021).
esteva-2017-skin-cancer.md	Esteva, A., Kuprel, B., Novoa, R. A., Ko, J., Swetter, S. M., Blau, H. M., & Thrun, S. (2017). Dermatologist-level classification of skin cancer with deep neural networks. Nature, 542(7639), 115–118.
everingham-2010-pascal-voc.md	Everingham, M., Van Gool, L., Williams, C. K. I., Winn, J., & Zisserman, A. (2010). The PASCAL Visual Object Classes (VOC) Challenge. International Journal of Computer Vision, 88(2), 303–338. https://doi.org/10.1007/s11263-009-0275-4
fu-2020-eyeq-riqa.md	Fu, H., Wang, B., Shen, J., Cui, S., Xu, Y., Liu, J., & Shao, L. (2020). Evaluation of Retinal Image Quality Assessment Networks in Different Color-spaces. arXiv preprint arXiv:1907.05345v4.
ganin-2016-dann.md	Ganin, Y., Ustinova, E., Ajakan, H., Germain, P., Larochelle, H., Laviolette, F., Marchand, M., & Lempitsky, V. (2016). Domain-adversarial training of neural networks. Journal of Machine Learning Research, 17(59), 1–35.
gargeya-2017-automated-dr.md	Gargeya, R., & Leng, T. (2017). Automated Identification of Diabetic Retinopathy Using Deep Learning. Ophthalmology, 124(7), 962–969.
geetha-hema-2026.md	Geetha, T., & Hema, C. (2026). Deep learning-based joint analysis of diabetic retinopathy and glaucoma in retinal fundus images. Scientific Reports, 16, 3133. https://doi.org/10.1038/s41598-025-32991-y
gettinger-2025.md	Gettinger, K., Lee, D., Tomita, Y., Negishi, K., & Kurihara, T. (2025). Diabetic retinopathy, a comprehensive overview on pathophysiology and relevant experimental models. International Journal of Molecular Sciences, 26, 9882. https://doi.org/10.3390/ijms26209882
goh-2024-vit-vs-cnn.md	Goh, J. H. L., Ang, E., Srinivasan, S., Lei, X., Loh, J., Quek, T. C., Xue, C., Xu, X., Liu, Y., Cheng, C.-Y., Rajapakse, J. C., & Tham, Y.-C. (2024). Comparative analysis of vision transformers and conventional convolutional neural networks in detecting referable diabetic retinopathy. Ophthalmology Science, 4(6), 100552.
gonzalez-diaz-2024.md	González-Díaz, J. E., Reyes-Delgado, A. J., Sánchez-Cervantes, J. L., Mejia-Miranda, J., Alor-Hernández, G., & Rodríguez-Mazahua, L. (2024). Use of Vision Transformers in Ophthalmology for Early Detection of Age-Related Macular Degeneration (AMD): A Comparative Analysis. Preprints.org, 20241101740. https://doi.org/10.20944/preprints202411.1740.v1
grill-2020-byol.md	Grill, J.-B., Strub, F., Altché, F., Tallec, C., Richemond, P. H., Buchatskaya, E., … Valko, M. (2020). Bootstrap Your Own Latent: A New Approach to Self-Supervised Learning. Advances in Neural Information Processing Systems (NeurIPS), 33, 21271–21284. (arXiv:2006.07733)
gulshan-2016-supplementary-validation.md	Gulshan, V., Peng, L., Coram, M., et al. (2016). Development and validation of a deep learning algorithm for detection of diabetic retinopathy in retinal fundus photographs. JAMA. https://doi.org/10.1001/jama.2016.17216
gulshan-2016.md	Gulshan, V., Peng, L., Coram, M., Stumpe, M. C., Wu, D., Narayanaswamy, A., Venugopalan, S., Widner, K., Madams, T., Cuadros, J., Kim, R., Raman, R., Nelson, P. C., Mega, J. L., & Webster, D. R. (2016). Development and validation of a deep learning algorithm for detection of diabetic retinopathy in retinal fundus photographs. JAMA, 316(22), 2402–2410.
guo-2017-calibration.md	Guo, C., Pleiss, G., Sun, Y., & Weinberger, K. Q. (2017). On Calibration of Modern Neural Networks. Proceedings of the 34th International Conference on Machine Learning (ICML), PMLR 70, 1321–1330. (arXiv:1706.04599)
hayati-2023.md	Hayati, M., Muchtar, K., Roslidar, Maulina, N., Syamsuddin, I., Elwirehardja, G. N., & Pardamean, B. (2023). Impact of CLAHE-based image enhancement for diabetic retinopathy classification through deep learning. Procedia Computer Science, 216, 57–66.
he-2016-deep-residual-learning.md	He, K., Zhang, X., Ren, S., & Sun, J. (2016). Deep residual learning for image recognition. In Proceedings of the IEEE Conference on Computer Vision and Pattern Recognition (CVPR 2016) (pp. 770–778). IEEE.
he-2020-moco.md	He, K., Fan, H., Wu, Y., Xie, S., & Girshick, R. (2020). Momentum Contrast for Unsupervised Visual Representation Learning. Proceedings of the IEEE/CVF Conference on Computer Vision and Pattern Recognition (CVPR), 9729–9738. (arXiv:1911.05722)
he-2022-mae.md	He, K., Chen, X., Xie, S., Li, Y., Dollár, P., & Girshick, R. (2022). Masked Autoencoders Are Scalable Vision Learners. Proceedings of the IEEE/CVF Conference on Computer Vision and Pattern Recognition (CVPR), 16000–16009. (arXiv:2111.06377)
huang-2017-densenet.md	Huang, G., Liu, Z., van der Maaten, L., & Weinberger, K. Q. (2017). Densely Connected Convolutional Networks. In Proceedings of the IEEE Conference on Computer Vision and Pattern Recognition (CVPR) (pp. 2261–2269).
hungerford-1999-muon-capture-proton-emission.md	Hungerford, E. V. (1999). Comments on Proton Emission after Muon Capture (Technical Report MECO-34). Department of Physics, University of Houston.
ioffe-2015-batch-normalization.md	Ioffe, S., & Szegedy, C. (2015). Batch Normalization: Accelerating Deep Network Training by Reducing Internal Covariate Shift. Proceedings of the 32nd International Conference on Machine Learning (ICML), 448–456. (arXiv:1502.03167)
kesharwani-2021.md	Kesharwani, D., Parashar, S., Varghese, J., & Sune, P. (2021). A review of diabetic retinopathy—Pathophysiology, clinical presentation, and management. Journal of Pharmaceutical Research International, 33(60B), 698–704. https://doi.org/10.9734/JPRI/2021/v33i60B34668
khosravi-2025.md	Khosravi, P., Huck, N. A., Shahraki, K., Ghafari, E., Azimi, R., Kim, S. Y., Crouch, E., Xie, X., & Suh, D. W. (2025). External validation of deep learning models for classifying etiology of retinal hemorrhage using diverse fundus photography datasets. Bioengineering, 12(1), 20. https://doi.org/10.3390/bioengineering12010020
kingma-2015-adam.md	Kingma, D. P., & Ba, J. (2015). Adam: A Method for Stochastic Optimization. Proceedings of the 3rd International Conference on Learning Representations (ICLR). (arXiv:1412.6980)
koch-2019-hermite-ratios.md	Koch, T. (2019). Universal bounds and monotonicity properties of ratios of Hermite and parabolic cylinder functions. arXiv preprint arXiv:1905.10274.
kornblith-2019-transferability.md	Kornblith, S., Shlens, J., & Le, Q. V. (2019). Do Better ImageNet Models Transfer Better? In Proceedings of the IEEE/CVF Conference on Computer Vision and Pattern Recognition (CVPR 2019) (pp. 2661–2671). IEEE/CVF.
krause-2018-grader-variability.md	Krause, J., Gulshan, V., Rahimy, E., Karth, P., Widner, K., Corrado, G. S., Peng, L., & Webster, D. R. (2018). Grader Variability and the Importance of Reference Standards for Evaluating Machine Learning Models for Diabetic Retinopathy. Ophthalmology, 125(8), 1264–1272. (arXiv:1710.01711)
krizhevsky-2012-alexnet.md	Krizhevsky, A., Sutskever, I., & Hinton, G. E. (2012). ImageNet Classification with Deep Convolutional Neural Networks. In Advances in Neural Information Processing Systems 25 (NeurIPS 2012).
kusuhara-2018.md	Kusuhara, S., Fukushima, Y., Ogura, S., Inoue, N., & Uemura, A. (2018). Pathophysiology of diabetic retinopathy: The old and the new. Diabetes & Metabolism Journal, 42(5), 364–376. https://doi.org/10.4093/dmj.2018.0182
li-2019-ddr.md	Li, T., Gao, Y., Wang, K., Guo, S., Liu, H., & Kang, H. (2019). Diagnostic assessment of deep learning algorithms for diabetic retinopathy screening. Information Sciences, 501, 511–522. https://doi.org/10.1016/j.ins.2019.06.011
lin-2017-focal-loss.md	Lin, T.-Y., Goyal, P., Girshick, R., He, K., & Dollár, P. (2017). Focal Loss for Dense Object Detection. Proceedings of the IEEE International Conference on Computer Vision (ICCV), 2980–2988. (arXiv:1708.02002)
litjens-2017-medical-dl-survey.md	Litjens, G., Kooi, T., Bejnordi, B. E., Setio, A. A. A., Ciompi, F., Ghafoorian, M., … Sánchez, C. I. (2017). A survey on deep learning in medical image analysis. Medical Image Analysis, 42, 60–88. (arXiv:1702.05747)
liu-2021-swin-transformer.md	Liu, Z., Lin, Y., Cao, Y., Hu, H., Wei, Y., Zhang, Z., Lin, S., & Guo, B. (2021). Swin Transformer: Hierarchical Vision Transformer using Shifted Windows. Proceedings of the IEEE/CVF International Conference on Computer Vision (ICCV), 10012–10022. (arXiv:2103.14030)
liu-2022.md	Liu, R., Wang, X., Wu, Q., Dai, L., Fang, X., Yan, T., Son, J., Tang, S., Li, J., Gao, Z., Galdran, A., Poorneshwaran, J.M., Liu, H., Wang, J., Chen, Y., Porwal, P., Tan, G.S.W., Yang, X., Dai, C., Song, H., Chen, M., Li, H., Jia, W., Shen, D., Sheng, B., & Zhang, P. (2022). DeepDRiD: Diabetic Retinopathy—Grading and Image Quality Estimation Challenge. Patterns, 3(6), 100512. https://doi.org/10.1016/j.patter.2022.100512
lundberg-2017-shap.md	Lundberg, S. M., & Lee, S.-I. (2017). A Unified Approach to Interpreting Model Predictions. In Proceedings of the 31st Conference on Neural Information Processing Systems (NIPS 2017), Long Beach, California, USA. arXiv:1705.07874v2.
morya-2024.md	Morya, A. K., Ramesh, P. V., Nishant, P., Kaur, K., Gurnani, B., Heda, A., & Salodia, S. (2024). Diabetic retinopathy: A review on its pathophysiology and novel treatment modalities. World Journal of Methodology, 14(4), 95881. https://doi.org/10.5662/wjm.v14.i4.95881
nandal-2024.md	Nandal, A. (2024). Optimizing interoperability in healthcare: AI-driven HL7 and FHIR implementations for seamless data exchange. Journal of International Crisis and Risk Communication Research, 7(S1), 70–76.
odir-2019-dataset.md	Peking University International Competition on Ocular Disease Intelligent Recognition (ODIR-2019) [Electronic resource]. – Grand Challenge, 2019. – URL: https://odir2019.grand-challenge.org/ (date of access: 16.06.2026).
ostahie-2015-shortcut-edge-states.md	Ostahie, B., Niță, M., & Aldea, A. (2015). Electrical manipulation of the edge states in graphene and the effect on the quantum Hall transport. arXiv preprint arXiv:1411.7808v2.
pachade-2021-rfmid.md	Pachade, S., Porwal, P., Thulkar, D., Kokare, M., Deshmukh, G., Sahasrabuddhe, V., Giancardo, L., Quellec, G., & Mériaudeau, F. (2021). Retinal Fundus Multi-Disease Image Dataset (RFMiD): A dataset for multi-disease detection research. Data, 6(2), 14. https://doi.org/10.3390/data6020014
pan-2010-transfer-learning-survey.md	Pan, S. J., & Yang, Q. (2010). A Survey on Transfer Learning. IEEE Transactions on Knowledge and Data Engineering, 22(10), 1345–1359.
pizer-1987-adaptive-histogram-equalization.md	Pizer, S. M., Amburn, E. P., Austin, J. D., Cromartie, R., Geselowitz, A., Greer, T., ter Haar Romeny, B., Zimmerman, J. B., & Zuiderveld, K. (1987). Adaptive histogram equalization and its variations. Computer Vision, Graphics, and Image Processing, 39(3), 355–368. Academic Press.
porwal-2018-idrid-challenge.md	Porwal, P., Pachade, S., Kamble, R., Kokare, M., Deshmukh, G., Sahasrabuddhe, V., & Meriaudeau, F. (2018). Indian Diabetic Retinopathy Image Dataset (IDRiD): A database for diabetic retinopathy screening research. Data, 3(3), 25. https://doi.org/10.3390/data3030025
porwal-2018-idrid-dataset.md	Porwal, P., Pachade, S., Kamble, R., Kokare, M., Deshmukh, G., Sahasrabuddhe, V., & Meriaudeau, F. (2018). Indian Diabetic Retinopathy Image Dataset (IDRiD): A database for diabetic retinopathy screening research. Data, 3(3), 25. https://doi.org/10.3390/data3030025
pratt-2016.md	Pratt, H., Coenen, F., Broadbent, D. M., Harding, S. P., & Zheng, Y. (2016). Convolutional neural networks for diabetic retinopathy. Procedia Computer Science, 90, 200–205.
quellec-2017-deep-image-mining.md	Quellec, G., Charrière, K., Boudi, Y., Cochener, B., & Lamard, M. (2017). Deep image mining for diabetic retinopathy screening. Medical Image Analysis, 39, 178–193. (arXiv:1610.07086)
rakhlin-2017.md	Rakhlin, A. (2017). Diabetic retinopathy detection through integration of deep learning classification framework [Preprint]. bioRxiv. https://doi.org/10.1101/225508
rezatofighi-2019-giou.md	Rezatofighi, H., Tsoi, N., Gwak, J., Sadeghian, A., Reid, I., & Savarese, S. (2019). Generalized Intersection over Union: A Metric and A Loss for Bounding Box Regression. arXiv. https://arxiv.org/abs/1902.09630
ribeiro-2016-lime.md	Ribeiro, M. T., Singh, S., & Guestrin, C. (2016). “Why Should I Trust You?”: Explaining the Predictions of Any Classifier. Proceedings of the 22nd ACM SIGKDD International Conference on Knowledge Discovery and Data Mining (KDD 2016), 1135–1144. ACM.
ruamviboonsuk-2022.md	Ruamviboonsuk, P., Tiwari, R., Sayres, R., Nganthavee, V., Hemarat, K., Kongprayoon, A., Raman, R., Levinstein, B., Liu, Y., Schaekermann, M., Lee, R., Virmani, S., Widner, K., Chambers, J., Hersch, F., Peng, L., & Webster, D. R. (2022). Real-time diabetic retinopathy screening by deep learning in a multisite national screening programme: A prospective interventional cohort study. The Lancet Digital Health, 4(4), e235–e244.
ryu-2021-octa.md	Ryu, G., Lee, K., Park, D., Park, S. H., & Sagong, M. (2021). A deep learning model for identifying diabetic retinopathy using optical coherence tomography angiography. Scientific Reports, 11, 23024. https://doi.org/10.1038/s41598-021-02479-6
samek-2017-explainable-ai.md	Samek, W., Wiegand, T., & Müller, K.-R. (2017). Explainable artificial intelligence: Understanding, visualizing and interpreting deep learning models. arXiv preprint arXiv:1708.08296.
sanchez-gutierrez-2022.md	Sánchez-Gutiérrez, V., Hernández-Martínez, P., Muñoz-Negrete, F. J., Engelberts, J., Luger, A. M., & van Grinsven, M. J. J. P. (2022). Performance of a deep learning system for detection of referable diabetic retinopathy in real clinical settings. [Journal name NOT REPORTED in preprint].
saxena-2020.md	Saxena, G., Verma, D. K., Paraye, A., Rajan, A., & Rawat, A. (2020). Improved and robust deep learning agent for preliminary detection of diabetic retinopathy using public datasets. Intelligence-Based Medicine, 3–4, 100022.
selvaraju-2017-grad-cam.md	Selvaraju, R. R., Cogswell, M., Das, A., Vedantam, R., Parikh, D., & Batra, D. (2017). Grad-CAM: Visual Explanations from Deep Networks via Gradient-based Localization. Proceedings of the IEEE International Conference on Computer Vision (ICCV), 618–626.
senapati-2024.md	Senapati, A., Tripathy, H. K., Sharma, V., & Gandomi, A. H. (2024). Artificial intelligence for diabetic retinopathy detection: A systematic review. Informatics in Medicine Unlocked, 45, 101445. https://doi.org/10.1016/j.imu.2024.101445
shaout-han-2025.md	Shaout, A., & Han, J. (2025). A novel retinal image contrast enhancement — Fuzzy-based method. arXiv preprint arXiv:2502.17850v2.
sharma-2025-vit-capsule.md	Sharma, V., Rishu, Kukreja, V., Dogra, A., & Goyal, B. (2025). Transforming retinal diagnostics: Advanced detection of diabetic retinopathy using vision transformers and capsule networks. Journal of Computer Science, 21(2), 304–321. https://doi.org/10.3844/jcssp.2025.304.321
shen-2020-cofe-net.md	Shen, Z., Fu, H., Shen, J., & Shao, L. (2020). Modeling and Enhancing Low-Quality Retinal Fundus Images. IEEE Transactions on Medical Imaging, 40(3), 996–1006. (arXiv:2005.05594)
shorten-2019-augmentation-survey.md	Shorten, C., & Khoshgoftaar, T. M. (2019). A survey on Image Data Augmentation for Deep Learning. Journal of Big Data, 6(1), 60.
shurrab-2022-ssl-medical-survey.md	Shurrab, S., & Duwairi, R. (2022). Self-supervised learning methods and applications in medical imaging analysis: a survey. PeerJ Computer Science, 8, e1045.
simonyan-2015-vgg.md	Simonyan, K., & Zisserman, A. (2015). Very Deep Convolutional Networks for Large-Scale Image Recognition. Proceedings of the 3rd International Conference on Learning Representations (ICLR). (arXiv:1409.1556)
son-2020-multiple-findings.md	Son, J., Shin, J. Y., Kim, H. D., Jung, K.-H., Park, K. H., & Park, S. J. (2020). Development and Validation of Deep Learning Models for Screening Multiple Abnormal Findings in Retinal Fundus Images. Ophthalmology, 127(1), 85–94.
srivastava-2014-dropout.md	Srivastava, N., Hinton, G., Krizhevsky, A., Sutskever, I., & Salakhutdinov, R. (2014). Dropout: A Simple Way to Prevent Neural Networks from Overfitting. Journal of Machine Learning Research, 15(56), 1929–1958.
szegedy-2015-googlenet.md	Szegedy, C., Liu, W., Jia, Y., Sermanet, P., Reed, S., Anguelov, D., … Rabinovich, A. (2015). Going Deeper with Convolutions. Proceedings of the IEEE Conference on Computer Vision and Pattern Recognition (CVPR), 1–9. (arXiv:1409.4842)
szegedy-2016-inception-v3.md	Szegedy, C., Vanhoucke, V., Ioffe, S., Shlens, J., & Wojna, Z. (2016). Rethinking the Inception Architecture for Computer Vision. Proceedings of the IEEE Conference on Computer Vision and Pattern Recognition (CVPR), 2818–2826. (arXiv:1512.00567)
tabari-2024.md	Tabari, P., Costagliola, G., De Rosa, M., & Boeker, M. (2024). Best practices for implementation and development of data models and structures based on FHIR: A systematic scoping review. JMIR Preprints. https://doi.org/10.2196/preprints.58445
tan-2019-efficientnet.md	Tan, M., & Le, Q. V. (2019). EfficientNet: Rethinking Model Scaling for Convolutional Neural Networks. In Proceedings of the 36th International Conference on Machine Learning (ICML 2019), PMLR 97.
tan-2021-efficientnetv2.md	Tan, M., & Le, Q. V. (2021). EfficientNetV2: Smaller Models and Faster Training. In Proceedings of the 38th International Conference on Machine Learning (ICML 2021), PMLR 139, 10096–10106.
ting-2017.md	Ting, D. S. W., Cheung, C. Y.-L., Lim, G., Tan, G. S. W., Quang, N. D., Gan, A., Hamzah, H., Garcia-Franco, R., San Yeo, I. Y., Lee, S. Y., Wong, E. Y. M., Sabanayagam, C., Baskaran, M., Ibrahim, F., Tan, N. C., Finkelstein, E. A., Lamoureux, E. L., Wong, I. Y., Bressler, N. M., ... Wong, T. Y. (2017). Development and validation of a deep learning system for diabetic retinopathy and related eye diseases using retinal images from multiethnic populations with diabetes. JAMA, 318(22), 2211–2223.
ting-2019-dl-ophthalmology-review.md	Ting, D. S. W., Peng, L., Varadarajan, A. V., Keane, P. A., Burlina, P. M., Chiang, M. F., … Wong, T. Y. (2019). Deep learning in ophthalmology: The technical and clinical considerations. Progress in Retinal and Eye Research, 72, 100759.
tjoa-2020-xai-survey.md	Tjoa, E., & Guan, C. (2020). A Survey on Explainable Artificial Intelligence (XAI): towards Medical XAI. arXiv preprint arXiv:1907.07374v5.
tomasi-1998-bilateral-filtering.md	Tomasi, C., & Manduchi, R. (1998). Bilateral filtering for gray and color images. In Proceedings of the 1998 IEEE International Conference on Computer Vision (ICCV), Bombay, India. IEEE.
voets-2019-reproduction-study.md	Voets, M., Møllersen, K., & Bongo, L. A. (2019). Reproduction study using public data of: Development and validation of a deep learning algorithm for detection of diabetic retinopathy in retinal fundus photographs. PLOS ONE, 14(6), e0217541. https://doi.org/10.1371/journal.pone.0217541.
